{
  "bakeoffId": "shared-card-geometry-reviewed-corners-v1",
  "candidate": "yolo11s-pose",
  "corpus": {
    "corpusHash": "41c110e13eef6c898d31ed9ba7e56bdc449f3651ffb6ad7f103655eac60495cf",
    "datasetRepo": "ahzs645/tcger-scanner-images",
    "datasetRevision": "3759819e007e6ee755b530652c3d72abbd96963f",
    "policyId": "training-minimums-v4",
    "policySha256": "d1f38ac331ef3eef1e632f6f3874cd1f33967c073ca33dbbec26c8547a9080f6",
    "preflightReport": {
      "path": "geometry/preflights/41c110e13eef6c898d31ed9ba7e56bdc449f3651ffb6ad7f103655eac60495cf/8e315f1b5fb18643f97a30fd159b904324e21181ed45c69e6ce20624b53d336a.json",
      "sha256": "8e315f1b5fb18643f97a30fd159b904324e21181ed45c69e6ce20624b53d336a"
    },
    "releasePath": "geometry/releases/card-geometry-training-reviewed-corners-v1"
  },
  "deviations": [
    {
      "candidateValue": {
        "evaluationContractVersion": 2,
        "yolo11NumpyInputColor": "bgr"
      },
      "reason": "Evaluation contract version 2: the shared evaluator hands Ultralytics BGR arrays, matching its file loader; round-two version-1 reports passed RGB and remain as published. Applies identically to every candidate; only YOLO11 inference pixels change.",
      "rule": "evaluation-script"
    },
    {
      "candidateValue": {
        "corpusHash": "41c110e13eef6c898d31ed9ba7e56bdc449f3651ffb6ad7f103655eac60495cf",
        "reflectedBorderTargetsRemoved": 32,
        "reviewedLabels": 1378,
        "reviewedNonCardsRemoved": 4
      },
      "reason": "Follow-up to the 2026-09-07 YOLO11s successor: import the completed 259-frame review; retain 656 cut-off/occluded box targets, derive five occluded corner flags from seven reviewed layer relationships, and remove reflected-border artifacts and four reviewed non-cards. All evaluation inputs remain unchanged.",
      "rule": "corpus-release"
    },
    {
      "candidateValue": {
        "realContextMarginPolicy": {
          "application": "each-side",
          "fraction": 0.16,
          "kind": "fraction-of-long-side",
          "rounding": "ceil"
        }
      },
      "reason": "Increase fixed real training context from 15% to 16% of the long side, preserving every reviewed outside-frame coordinate. One corner at x=1.158788 on a 512px image exceeds the previous 77px margin by about 4.3px; the new 82px margin contains it. Synthetic and evaluation padding remain unchanged.",
      "rule": "augmentation"
    }
  ],
  "evaluations": {
    "frozenReal": {
      "corpusHash": "631cc7f9ac24b19d5e7587f5c5aefa401f911cfcf4ed52ab6858ea29d3740dd7",
      "datasetRepo": "ahzs645/tcger-scanner-images",
      "datasetRevision": "3e03b753158b602b9f4ec3bdace2de05a5b2e5f2",
      "releasePath": "geometry/releases/real-geometry-evaluation-v6-full-aliases-v2"
    },
    "goldenFixtures": {
      "path": "tools/card-geometry/fixtures/validation-nms.v1.json",
      "sha256": "ec0f877af9d0f2afe4f6a76c7a4590c033fa0d35027815330adb24c540532168"
    },
    "recognitionModels": {
      "games": {
        "magic": {
          "metadata": {
            "path": "exports/magic/full/CardsIndexMetadata.json",
            "sha256": "35759a1443c6466847ec584b3ad6581d23e4624c91bc6f943f77f2a595461e54"
          },
          "onnx": {
            "path": "exports/magic/full/card-embeddings-arcface-fp32.onnx",
            "sha256": "ebc725476ec2866cd054cd16ef9bcda257bbfdc5aa05326a79335abc4fdc0d3e"
          },
          "queryNormalization": "grey-world-autocontrast",
          "strongThreshold": 0.7,
          "vectors": {
            "path": "exports/magic/full/CardsIndexVectors-arcface.bin",
            "sha256": "4449c186a23ceef512a7786d73f32c8322dc45c7279e90f3dfbc75d7cdc135e8"
          }
        },
        "pokemon": {
          "metadata": {
            "path": "exports/pokemon/full/CardsIndexMetadata.json",
            "sha256": "5bcc886d58fca214800d366d080a438515d7820ffe03fcea7395496b5ef08117"
          },
          "onnx": {
            "path": "exports/pokemon/full/card-embeddings-arcface-fp32.onnx",
            "sha256": "bd7367284130639345efbe967e5e80b4aadf0ab5d5bc922968d2b06e497eea44"
          },
          "queryNormalization": "none",
          "strongThreshold": 0.65,
          "vectors": {
            "path": "exports/pokemon/full/CardsIndexVectors-arcface.bin",
            "sha256": "d78e06b0909f39f57deab5c04c1bfb20671bf933f95033f143942e8cc388bdc3"
          }
        },
        "yugioh": {
          "metadata": {
            "path": "exports/yugioh/full/CardsIndexMetadata.json",
            "sha256": "0ab3fec12511b401244b1f80ac12ac432f10cdb2afdcfc59f7797568d50cca5e"
          },
          "onnx": {
            "path": "exports/yugioh/full/card-embeddings-arcface-fp32.onnx",
            "sha256": "b304bde2171d8ca4a824a4e0cab4bc22c3b31e425a8ba5e3ef91aab4ec6f9d58"
          },
          "queryNormalization": "none",
          "strongThreshold": 0.65,
          "vectors": {
            "path": "exports/yugioh/full/CardsIndexVectors-arcface.bin",
            "sha256": "2de604679f08018e18fe3f3db188414add77fba51c6e8c52c4eb8b87cea8cbdd"
          }
        }
      },
      "modelRepo": "ahzs645/tcger-universal-arcface",
      "modelRevision": "3e51bbba70c6fbc6d07bdc6d1f4ea4ac7a00f7cb"
    },
    "recognitionReplay": {
      "path": "docs/scanner-system/benchmarks/2026-09-02-shared-card-geometry/reports/device-geometry-outcomes.json",
      "sha256": "05b56efb2ece661100fab8c935485174e5d59aae562704002e86349e008a5997"
    },
    "syntheticMultigame": {
      "corpusHash": "fb3eca1aa55d99cbff03c1f0eb58600884be879af2d75b8b4becc3d94932ba05",
      "datasetRepo": "ahzs645/tcger-scanner-images",
      "datasetRevision": "3e03b753158b602b9f4ec3bdace2de05a5b2e5f2",
      "releasePath": "geometry/releases/synthetic-geometry-multigame-bakeoff-eval-v1-aliases-v2"
    }
  },
  "execution": {
    "checkpointRepo": "ahzs645/tcger-universal-arcface",
    "checkpointRepoPrivate": true,
    "containerImage": "pytorch/pytorch@sha256:77f17f843507062875ce8be2a6f76aa6aa3df7f9ef1e31d9d7432f4b0f563dee",
    "evaluationCommand": [
      "python",
      "tools/card-geometry/evaluate_geometry_candidate.py",
      "--candidate",
      "yolo11s-pose"
    ],
    "gpuFlavor": "l4x1",
    "privateExportCommands": {
      "coreml": [
        "python",
        "tools/card-geometry/export_geometry_candidate.py",
        "--candidate",
        "yolo11s-pose",
        "--format",
        "coreml"
      ],
      "onnx": [
        "python",
        "tools/card-geometry/export_geometry_candidate.py",
        "--candidate",
        "yolo11s-pose",
        "--format",
        "onnx"
      ]
    },
    "trainCommand": [
      "python",
      "tools/card-geometry/train_yolo_pose.py",
      "--candidate",
      "yolo11s-pose",
      "--base-url",
      "https://github.com/ultralytics/assets/releases/download/v8.4.0/yolo11s-pose.pt",
      "--base-sha256",
      "1060bda4a27012060eca246f9b2adeea22eabb045a1e58f8d229be29b7ebc2ba"
    ]
  },
  "fairness": {
    "augmentationProfile": "canonical-corpus-baked-v1:no-runtime-augmentation",
    "budget": {
      "kind": "epochs",
      "value": 50
    },
    "evaluationScript": {
      "path": "tools/card-geometry/benchmark_geometry.py",
      "sha256": "03d2595826f9c9dc5c3a6261c348045a1dea3f8e7efbe84f90e12df914b0b418"
    },
    "inputResolution": 640,
    "realContextMarginPolicy": {
      "application": "each-side",
      "fraction": 0.16,
      "kind": "fraction-of-long-side",
      "rounding": "ceil"
    },
    "seedPolicy": {
      "baseSeed": 20260905,
      "derivation": "base-plus-repeat-index",
      "repeatCount": 1
    }
  },
  "framework": "ultralytics",
  "licenseRoute": "evaluation-only",
  "measurements": {
    "coremlOnnxParity": true,
    "decoderCodeSize": true,
    "exportedBytesPlatforms": [
      "ios",
      "android",
      "web"
    ],
    "geometryRealV3": true,
    "geometrySyntheticDuelField": true,
    "l4GpuHours": true,
    "physicalLatencyPlatforms": [
      "ios",
      "android"
    ],
    "recognitionReplay": true
  },
  "schema": "https://tcger.app/schemas/card-geometry-experiment-config/v2",
  "toolingRevision": "9a96e11fb09aa82693eff9b0301e24b1dda9a734"
}
